text,timestamp,like_count
super proud dear president bbm,2021-12-07 00:00:00,
congratulation mr president bbm2022saraall,2021-12-07 00:00:00,
best debate ever watched,2021-12-07 00:00:00,
cheng mahinay yes teh nice kaau,2021-12-07 00:00:00,
temple alma diba day really nice learn lot,2021-12-07 00:00:00,
cheng mahinay yes teh maka stand ug fur,2021-12-07 00:00:00,
salute 4 especially bbm smni 4 panelsprof carlos strongp really cool blinded 4 tall bbm want debate,2021-12-07 00:00:00,
best,2021-12-07 00:00:00,
wonderful talent sir bbm come debate jump already everyone loses hahaha,2021-12-07 00:00:00,
perfect answer question love god,2021-12-07 00:00:00,
long live soon nxt president,2021-12-07 00:00:00,
congratulation po smni attended nice talk wow way hope something like vp nd senator runmatan ggal manlang mask othershehehebb,2021-12-07 00:00:00,
best leader sir bbmim impressed im proud yousna someday ill able meet youi wish marcos 2022 filipino tall anyonethe filipino u solid bbmsara 2022,2021-12-07 00:00:00,
god bless philippinesand next presidentbbm,2021-12-07 00:00:00,
great job mr president,2021-12-07 00:00:00,
top mr president proud ilocano cheer,2021-12-07 00:00:00,
tnx god bbm proud u,2021-12-07 00:00:00,
long live president ferdinand bongbong marcos jr god bless protect,2021-12-07 00:00:00,
healthy best debate far congratulation smni great job future president republic philippine bbm absolutely smart,2021-12-07 00:00:00,
great president,2021-12-07 00:00:00,
kristal jean fronda yay bbm maam,2021-12-07 00:00:00,
ervie keith quilala yes indeed,2021-12-07 00:00:00,
congrats bbm congrats smni,2021-12-07 00:00:00,
god bless nbm thank lord jesus spiritual guidance amen,2021-12-07 00:00:00,
ago group around compounded could pick lene family shouted bbm bbm bbm told picker stupid frowned compounded could bbm bbm,2021-12-07 00:00:00,
im driving work earlier suddenly thought bbm laughed said woww cant wait next president im excited im proud bbm youre best,2021-12-07 00:00:00,
great bbm,2021-12-07 00:00:00,
finale debate amazingg,2021-12-07 00:00:00,
hope become president country vaccine mandatory people especially child,2021-12-07 00:00:00,
said rock philippine pure heart,2021-12-07 00:00:00,
congratulation oh sir vote 101,2021-12-07 00:00:00,
love bbm fight continue make win,2021-12-07 00:00:00,
congrats beloved president,2021-12-07 00:00:00,
congrats bbm future president also want experience bbm handle philippine like fathernice u smart god bless bbm mam sara duterte supporter,2021-12-07 00:00:00,
congrats pop,2021-12-07 00:00:00,
congratulation mr president,2021-12-07 00:00:00,
youre man sir supporting uniteam bbmsara way 22,2021-12-07 00:00:00,
congratulation president soon bbm,2021-12-07 00:00:00,
b b marco sarah yes happy,2021-12-07 00:00:00,
onward next president philippine bbm duterte malacca nang,2021-12-07 00:00:00,
one watch live sir bbm live god bless,2021-12-07 00:00:00,
congratulation brother wil,2021-12-07 00:00:00,
proud supporter arejust bbm,2021-12-07 00:00:00,
salute also 3 participated bbm sorry leni lacson isk pacquiao debate country problem know solve problem aspiring president situation courage show people know handle everyone future president dealing leader country,2021-12-07 00:00:00,
happy event didnt brainstorm plan country issue thats level debate raised thats debate brainstorm thats difference journalist something like pure vandalism,2021-12-07 00:00:00,
bbm solid,2021-12-07 00:00:00,
bbm thats future president keep safe sir philippine needed bbmsara solid,2021-12-07 00:00:00,
outstanding bbm president,2021-12-07 00:00:00,
well president 2022,2021-12-07 00:00:00,
proud bbmunityteam,2021-12-07 00:00:00,
rose marie buendia rontas,2021-12-07 00:00:00,
congratulation mr president,2021-12-07 00:00:00,
eligible presidential aspirant nailed woah maka proud,2021-12-07 00:00:00,
thought question bbm interview question answer bad nose bleeds really see good platform people wise choice dont vote 1 candidate fee reason others say thats benefit sit dont care people thank bbm heart filipino people need,2021-12-07 00:00:00,
afraid face challenge debate ke sir bbmumur ong pant vest challenge challenge oh cant talent next president philippine bongbong rumoaldez marcos jr brain c bbmis beyond reach,2021-12-07 00:00:00,
proud solid marcos,2021-12-07 00:00:00,
best,2021-12-07 00:00:00,
good sir,2021-12-07 00:00:00,
love bbm,2021-12-07 00:00:00,
congratulation great sir next president,2021-12-07 00:00:00,
great congrats mr president,2021-12-07 00:00:00,
best debate far,2021-12-07 00:00:00,
proud president,2021-12-07 00:00:00,
congratulation president bbm na burn po sla enemy jn may satisfied brain understand sinbi bbm,2021-12-07 00:00:00,
long bbm solid north,2021-12-07 00:00:00,
congratulation president really enjoyed watching,2021-12-07 00:00:00,
go go go bbm let get rid,2021-12-07 00:00:00,
love much future really admire,2021-12-07 00:00:00,
rhaiven eustaquio im crazy mar,2021-12-07 00:00:00,
jovie jm know marz marcosen cousin marz rhaiven marcos mebwahaha haha sandro marcos life marzheheh,2021-12-07 00:00:00,
rhaiven improve mar,2021-12-07 00:00:00,
yes bbm sarah kami please live,2021-12-07 00:00:00,
good job sir,2021-12-07 00:00:00,
next president,2021-12-07 00:00:00,
go ferdie bong 17th president congratulation,2021-12-07 00:00:00,
nailed mr bongbong marcos future president job well done 022 2022,2021-12-07 00:00:00,
great job sir bbm president,2021-12-07 00:00:00,
congratulation,2021-12-07 00:00:00,
wooww majority leader yeehh,2021-12-07 00:00:00,
proud bbm supporter,2021-12-07 00:00:00,
bongbong best president philippine brought people life always happy,2021-12-07 00:00:00,
bbm solid,2021-12-07 00:00:00,
bbm sarah,2021-12-07 00:00:00,
qualified position,2021-12-07 00:00:00,
best pbbm,2021-12-07 00:00:00,
hope tagalog filipino people understand filipino people election,2021-12-07 00:00:00,
bravo sir bbmyoure best next president 2022 long live philippine,2021-12-07 00:00:00,
congratulation sir bongbong marcos president stay safe godbless,2021-12-07 00:00:00,
sir please take care health god bless,2021-12-07 00:00:00,
god bless president,2021-12-07 00:00:00,
absent popular 4 smart presidentiables,2021-12-07 00:00:00,
u great lakay,2021-12-07 00:00:00,
brilliant,2021-12-07 00:00:00,
proud mr president bbm,2021-12-07 00:00:00,
mabuhay uniteam solidbbmsara god bless next president bbm,2021-12-07 00:00:00,
someone already bbm 2022our next president,2021-12-07 00:00:00,
every corner calm without quarreling fighting socalled unity begin,2021-12-07 00:00:00,
good job president,2021-12-07 00:00:00,
congratulation,2021-12-07 00:00:00,
congratulation sir answer good,2021-12-07 00:00:00,
excellent answer next president bongbong marcos,2021-12-07 00:00:00,
well sir bbm,2021-12-07 00:00:00,
youre good job president,2021-12-07 00:00:00,
nothing beat intelligence soon president bbm lot respect trust seneo dear bbm inday sarah believe implement good aspiration country,2021-12-07 00:00:00,
love bbm sara duterteuww sitting know philippine fine one suffer always let work together development country im even bone im pray dear lord guide give strong body accomplish good aspiration filipino peoplesawa poverty ready cry family separated family long timesamsa may rise live,2021-12-07 00:00:00,
well mr president congratulation smni panelist meaningful presidential debate also intellectual question especially prof clarita carlos really information campaign many commercial advertisement,2021-12-07 00:00:00,
good organizer case facei stop crap,2021-12-07 00:00:00,
bad didnt participate smni debate four presidentiables hope whole people saw answer question prof clarita carlos future foreign policy npa terrorist issue,2021-12-07 00:00:00,
great future president,2021-12-07 00:00:00,
mitzi lleve,2021-12-07 00:00:00,
totally nailed sir especially mentioned ntfelcac,2021-12-07 00:00:00,
uniteam love unity bbmsara city get security agapay reality lift congratulation incoming 17th president vice president republic philippine,2021-12-07 00:00:00,
good job pres bbm careful family,2021-12-07 00:00:00,
debate watched calmly everyone focused platform personal issue slandering candidate,2021-12-07 00:00:00,
congratulation next president bbm guy great also sir abella sir gonzales congratulation,2021-12-07 00:00:00,
yes president one philippine god bless po ingatbbm filipino,2021-12-07 00:00:00,
ra vicking thank,2021-12-07 00:00:00,
job well done senator marcos future president,2021-12-07 00:00:00,
clearer believe ability leader country long live apo bbm hope participate debate unity shouting reach people,2021-12-07 00:00:00,
bmm,2021-12-07 00:00:00,
brillant tlga c bbm qualified among aspirant,2021-12-07 00:00:00,
laban bbm solidly supporting quiet president,2021-12-07 00:00:00,
president,2021-12-07 00:00:00,
sir bbm admirable lodi,2021-12-07 00:00:00,
bbm proper answer god bless bbm god bless uniteam,2021-12-07 00:00:00,
whole country friendly bbm 09,2021-12-07 00:00:00,
salute sir future president bbm president,2021-12-07 00:00:00,
goosebump love bbm nailed idol,2021-12-07 00:00:00,
people like declare dont want mandatory vaccine 100 percent added vote,2021-12-07 00:00:00,
evelyn arcega,2021-12-07 00:00:00,
congratulation smni hope mutual respect prevails like love unity must spread hate power smni looking forward debate,2021-12-07 00:00:00,
bestbbm,2021-12-07 00:00:00,
congratulation sir youre afraid bald thats,2021-12-07 00:00:00,
congra2lations bbm sara team,2021-12-07 00:00:00,
80k watching live wow im one,2021-12-07 00:00:00,
one saw met found aspirant president running apart always front camera hopefully everyone invited,2021-12-07 00:00:00,
love pop,2021-12-07 00:00:00,
well done bbm,2021-12-07 00:00:00,
congratulation sir bongbong marcos proud answer professor question really direct point clarita carlos inspiration support like also son inspiration study want lawyer skl,2021-12-07 00:00:00,
congratulation bbm next president 2022,2021-12-07 00:00:00,
love,2021-12-07 00:00:00,
madumb fenk hemorrhoid,2021-12-07 00:00:00,
smni great panelist especially prof carlos 4 presidential aspirant wonderful flow debate would happened good bbm sara tandem may 3 given opportunity appointed sit position know well congratulation,2021-12-07 00:00:00,
im proud next president,2021-12-07 00:00:00,
love bbm,2021-12-07 00:00:00,
good job sir,2021-12-07 00:00:00,
congratulation bbm best,2021-12-07 00:00:00,
proud president greatjob well donegodbless u,2021-12-07 00:00:00,
future president great bong bong marcos,2021-12-07 00:00:00,
bbm really best,2021-12-07 00:00:00,
best debate ever,2021-12-07 00:00:00,
really great job former president bbm,2021-12-07 00:00:00,
proud ilocano apo bbm made u prouder proud delivering smart answer question thrown made gain applause together rise towards unity love country philippine marcos latta still marcos,2021-12-07 00:00:00,
rizza josephine korek rizza dear ilocano nalaing nasingpet ken haan nalastog thats marcos latta,2021-12-07 00:00:00,
true manang macon,2021-12-07 00:00:00,
salute bbm still awe intelligence humbleness humility love fellow countryman especially ofws lastly focus republic philippine,2021-12-07 00:00:00,
kian jensen answer intelligently came debate heavy question truly leader nation,2021-12-07 00:00:00,
chebed indeed hat panelist throwing heavy question especially prof carlos candidate bravery answer thats even interesting vision promise must first hand reality issue platform hundredfold reason support president,2021-12-07 00:00:00,
ping one absent qualified president good thing others debate talk nonsense bbm,2021-12-07 00:00:00,
salute sir bbm god bless live,2021-12-07 00:00:00,
proud president,2021-12-07 00:00:00,
thats real debate impromptu scripted panelist great kudos participated,2021-12-07 00:00:00,
bbm thats best thats useless interview,2021-12-07 00:00:00,
best,2021-12-07 00:00:00,
salute president bbm,2021-12-07 00:00:00,
future president,2021-12-07 00:00:00,
congratulation bbm,2021-12-07 00:00:00,
best debate seen far,2021-12-07 00:00:00,
bbmsara 2022you really hope u farmer nueva ecija entire countrygood luck sir,2021-12-07 00:00:00,
im proud youbpm,2021-12-07 00:00:00,
last man standing,2021-12-07 00:00:00,
full support president,2021-12-07 00:00:00,
exchange prof carlos amazing,2021-12-07 00:00:00,
good debate proud 2022,2021-12-07 00:00:00,
well done president bbm,2021-12-07 00:00:00,
future president really good bbm,2021-12-07 00:00:00,
future president 2022,2021-12-07 00:00:00,
good excellent person bbm sarah solid yes,2021-12-07 00:00:00,
salute candidate attended good luck,2021-12-07 00:00:00,
romblon sir,2021-12-07 00:00:00,
awesome bbm,2021-12-07 00:00:00,
fight fight len len,2021-12-07 00:00:00,
congratulation sir great proud bbm supporter bbm,2021-12-07 00:00:00,
solid bbm,2021-12-07 00:00:00,
bright humble future president bbm,2021-12-07 00:00:00,
didnt say anythingyou guy good stay safe god bless entire family,2021-12-07 00:00:00,
congrats,2021-12-07 00:00:00,
answer,2021-12-07 00:00:00,
good job pop,2021-12-07 00:00:00,
bbm iloveyousomuch,2021-12-07 00:00:00,
god bless philippine bbm,2021-12-07 00:00:00,
im proud called loyal supporter bbmsara uniteam,2021-12-07 00:00:00,
proud bbm,2021-12-07 00:00:00,
perfect answer proud bbm next president,2021-12-07 00:00:00,
congratulation mr president b b,2021-12-07 00:00:00,
bbm best best win nlng hahahahh,2021-12-07 00:00:00,
long live philippine long live president marcos,2021-12-07 00:00:00,
bbm solid,2021-12-07 00:00:00,
bbm best among allbig,2021-12-07 00:00:00,
well done bbm best answer question,2021-12-07 00:00:00,
bbm solid grandson,2021-12-07 00:00:00,
congratulation sir bbm watched plan come issue country love,2021-12-07 00:00:00,
intelligent debate starring prof carlos punisher,2021-12-07 00:00:00,
si bbm proud hope countryman depth great dream country,2021-12-07 00:00:00,
proud president bbm knowledgeable articulate confident god bless family also vice president sara god bless,2021-12-09 00:00:00,
proud next president bbmgod bless always protect bbm family,2021-12-09 00:00:00,
mother dislike,2021-12-09 00:00:00,
robert basan abella jr sad life dont mama lenlen spread word,2021-12-09 00:00:00,
robert basan abella jr failed thesis bos,2021-12-09 00:00:00,
robert basan abella jr 002 sir,2021-12-09 00:00:00,
robert basan abella jr 5 day old baby,2021-12-09 00:00:00,
robert basan abella jr im going leave soon sir,2021-12-09 00:00:00,
pinklawans,2021-12-09 00:00:00,
robert basan abella jr mother leni love,2021-12-09 00:00:00,
robert basan abella jr family rejected,2021-12-09 00:00:00,
robert basan abella jr thats dont want fight comment section maybe ill gone 30 day might reported let go dont bother let support bbm even dont respect understand,2021-12-09 00:00:00,
robert basan abella jr bbm said thank everyone watching,2021-12-09 00:00:00,
robert basan abella jr good thing love son one stole inherited bong bong mo hihi,2021-12-09 00:00:00,
pink stupidity bind,2021-12-09 00:00:00,
robert basan abella jr still angry emowhat pity thembbm made angry,2021-12-09 00:00:00,
laughed 18 hour,2021-12-09 00:00:00,
robert basan abella jr hahaha bet fake account mostly bitter still asleep,2021-12-09 00:00:00,
ej subiere im restrained im nice hahaha dont ask many accts hahaha,2021-12-09 00:00:00,
robert basan abella jr thats enough mother care,2021-12-09 00:00:00,
robert basan abella jr im happy win bbm promise,2021-12-09 00:00:00,
robert basan abella jr c bbm one truly love others,2021-12-09 00:00:00,
robert basan abella jr lost troll,2021-12-09 00:00:00,
robert basan abella jr truth tried 035 total reacted,2021-12-09 00:00:00,
anja malics experience hahahaha kc psawys hahaha ramdm karati sign ban q 24 h hahaha friend monton i2 hahaha,2021-12-09 00:00:00,
ej subiere im laughing hard dont hit anymore even worse hahaha,2021-12-09 00:00:00,
melbeth esteban well ive experienced everything 30 day acct never returned dont ask many,2021-12-09 00:00:00,
anja malics something like thats signed please kind enough send picture want fight c bbm sara,2021-12-09 00:00:00,
melbeth esteban taba hahaha ok bbmsar,2021-12-09 00:00:00,
thats,2021-12-09 00:00:00,
robert basan abella jr hahahaha omsim pure divorce socmed haha,2021-12-09 00:00:00,
youre right im teasing let mercy curl poor,2021-12-09 00:00:00,
robert basan abella jr troll course long im solid,2021-12-09 00:00:00,
long live president brilliant proud long live,2021-12-09 00:00:00,
brilliant intelligence proud itlike father like sonbongbong marcos may lord god protect always family,2021-12-09 00:00:00,
future president congrats stay safe god bless family proud,2021-12-09 00:00:00,
like father intelligent kind person god bless family stay safe always,2021-12-09 00:00:00,
god bless protect president bbm hope countrywith vice president sarahmake country known world prosperity peaceful place live leadershipma philippine live,2021-12-09 00:00:00,
proud next president answered correctly knowledgeable keep safe po god protect always,2021-12-09 00:00:00,
best among rest sir good luck always take care traveling around philippine god bless,2021-12-09 00:00:00,
salute president god bless protect always,2021-12-09 00:00:00,
well done may god continue bless wisdom courage need leader like kudos bbm sarah marcoses supporter,2021-12-09 00:00:00,
congratulation sir start already vote partner saw yoyr potential might change mind win soon although american citizenship filipino heart,2021-12-09 00:00:00,
congratulation bbm2022 may god continue bless family,2021-12-09 00:00:00,
best may god bless always,2021-12-09 00:00:00,
brilliant brave man god bless president,2021-12-09 00:00:00,
zudoarichikito mekashita dont pink allowed hahahha,2021-12-09 00:00:00,
zudoarichikito mekashita tanga spotted faceless jejemon haha iyak rest pink,2021-12-09 00:00:00,
congratulation sir bbm proud god bless u ur family,2021-12-09 00:00:00,
kudos nailed keep safe always sir godbless,2021-12-09 00:00:00,
congratulation soon mr president godbless keep safe always praying goodluck,2021-12-09 00:00:00,
kudos future president brilliant answer proud god bless always love,2021-12-09 00:00:00,
myra divinagracia modesty aside people say bbm coward destroy,2021-12-09 00:00:00,
nitz ringpis torrado thats least blind see whats true condemned god look heart take care destructive one,2021-12-09 00:00:00,
nitz ringpis torrado yes terrible thats theyre cowardly cant handle situation there plataforma thats already bbm others know fool,2021-12-09 00:00:00,
myra divinagracia omg100k mala sand bbmsara supporter flock lenlen surprised saw bbm sara supporter watch subscribe channel big thanks http youtube 8aolgplj3k,2021-12-09 00:00:00,
myra divinagracia point let pray together cheating election,2021-12-09 00:00:00,
nitz ringpis torrado yes always praying,2021-12-09 00:00:00,
kudos president brilliant smart idea point view better philippine looking forward success everything guidance lord love support dear president philippine god bless always,2021-12-09 00:00:00,
bbm best salute good job sir answer go directly question god bless,2021-12-09 00:00:00,
congratulation soontobe president philippine blessed god bless,2021-12-09 00:00:00,
elisa bucsit yes bbm,2021-12-09 00:00:00,
proud 2022 presidentbrav e intelligent nailed,2021-12-09 00:00:00,
congratulation pbbm knowledgeable answered question sincerity proud sir may god bless wisdom strength leading country,2021-12-09 00:00:00,
congratulation proud stay safe healthy god bless family thank inspiring u youre great message unity,2021-12-09 00:00:00,
congrats sirwr proud uur nxt presidentour vote ur teamonlystay safe alwaysgod bless,2021-12-09 00:00:00,
im proud u mr bbm u great job smni pres debate god bless u po congrats,2021-12-09 00:00:00,
gie joy insanhis father father well voice congrats bbm,2021-12-09 00:00:00,
panela lina yes cuz finished tlga ang haba worth learned lot,2021-12-09 00:00:00,
gie joy thats good cuz question spotthe question wont given advance know candidate answer solid,2021-12-09 00:00:00,
,2021-12-09 00:00:00,
proud 17th president knowledgeable articulate confident god bless protect family always bbm sara,2021-12-09 00:00:00,
michaela tabing wong amen jesus name,2021-12-09 00:00:00,
michaela tabing wong oxford kc really genius like father,2021-12-09 00:00:00,
michaela tabing wong solid,2021-12-09 00:00:00,
michaela tabing wong seem want make bongbong marcos historical people edsa martial law father ferdinand marcos like story son guess story son edsa martial law historical story name father son,2021-12-09 00:00:00,
michaela tabing wong cabalastic no17 equal 8 no8 successful number endeavor,2021-12-09 00:00:00,
started 12 midnight nz ended 4am 2 hour sleep going work totally worth congratulation four participant salute smni job well done,2021-12-09 00:00:00,
congratulation sir job well done answer enlighten still undecided,2021-12-09 00:00:00,
kudos 4 sir,2021-12-09 00:00:00,
congratulation advance god bless,2021-12-09 00:00:00,
brilliant pop god bless,2021-12-09 00:00:00,
well prepared fitted become next president watched yesterday im satisfied answer political issue youve got brilliant mind senator feel like thesis defense prof clarita asked question nailed god bless,2021-12-09 00:00:00,
chris mendoza didnt beat terrorlooking professor one got nervous saw aura prof clarita carlos prof really squeezed next presidentgood job bbm,2021-12-09 00:00:00,
salute sir qualified positiongod bless keep safe always,2021-12-09 00:00:00,
yes brilliant answer next president bbm got intelligence father proud dad god bless bbm whole marcos family relative,2021-12-09 00:00:00,
jessamyn adrian yes super smart tlga c bbm humble heart everyone,2021-12-09 00:00:00,
jessamyn adrian answer never straight point,2021-12-09 00:00:00,
congratulation sir ordinary citizen beloved philippine say debate informative weve learned lot listening candidate live,2021-12-09 00:00:00,
remz lyn palacsa caling,2021-12-09 00:00:00,
leah lyn jose updated,2021-12-09 00:00:00,
congratulation soon president stay safe god bless,2021-12-09 00:00:00,
congratulation yes proud love bbm god bless,2021-12-09 00:00:00,
thank much sir bbm tireless effort campaigning street letting u know platform plan country came smni debate prepared ready delivered confidence humility god bless,2021-12-09 00:00:00,
congrats sir bbm im proud best love god bless always,2021-12-09 00:00:00,
proud filipino sir bbm really destined next pres country kudos 4 hour debate answered question intellectually great country need great leader like vision goal love entire philippine live long bbmsara202 uniteam,2021-12-09 00:00:00,
congratulation sir job well done,2021-12-09 00:00:00,
good absentee catching,2021-12-09 00:00:00,
ginisang soup fyi leni supporter ur barking wrong tree im referring lenis comment pacman one answer advance question live interview,2021-12-09 00:00:00,
ginsang soup attend prof c castro question leni isko manny mam may go mom go cr,2021-12-09 00:00:00,
joshua john flores ask pakyaw answer face face dont know im excited porridge filled joke ill fight,2021-12-09 00:00:00,
joshua john flores orongan hahaha think conflict schedule didnt lost connection,2021-12-09 00:00:00,
jina saberola pee 4 time attending say excuse mam jingle ho,2021-12-09 00:00:00,
ja red girl,2021-12-09 00:00:00,
joshua john flores orongan carry na cla bbm,2021-12-09 00:00:00,
michael salazar gonzaga hidden side side,2021-12-09 00:00:00,
copying hahahah,2021-12-09 00:00:00,
present interview absent debate,2021-12-09 00:00:00,
joshua john flores orongan,2021-12-09 00:00:00,
joshua john flores orongan coward,2021-12-09 00:00:00,
joshua john flores orongan four took online class,2021-12-09 00:00:00,
joshua john flores orongan looking apparently getting idea panelist guest ahahaha cant answer anything ask kamotes,2021-12-09 00:00:00,
joshua john flores orongan future president even thanked four heheh,2021-12-09 00:00:00,
next debate drink aq png maintenance grandma qoh,2021-12-09 00:00:00,
four people want go gma kbp ccn comelec debate really coward bbm one going smni quibuloy endorsed biased biased endorsed face everyone nothing avoided bias ability thats unity db,2021-12-09 00:00:00,
joshua john flores orongan already said absent present live streaming hahaha ill sure copy answer case question,2021-12-09 00:00:00,
watched,2021-12-09 00:00:00,
joshua john flores orongan taking note online class next quiz know something answer peace,2021-12-09 00:00:00,
thats michael salazar gonzaga hahaha tpos sv appointment already hahaha feel watching,2021-12-09 00:00:00,
esterlyn p leal pede also,2021-12-09 00:00:00,
poor attend coward watch,2021-12-09 00:00:00,
joshua john flores orongan modular class professor,2021-12-09 00:00:00,
online class yern,2021-12-09 00:00:00,
donna lo tan,2021-12-09 00:00:00,
joshua john flores orongan said absentturned present,2021-12-09 00:00:00,
alhissa jane magbuhos want cute question doesnt like difficult one,2023-12-09 00:00:00,
joshua john flores orongan battle brain ignorant safe 4 presidential candidate left group,2021-12-09 00:00:00,
proud bbm salute god bless,2021-12-09 00:00:00,
difficult moment doesnt show prof clarita carlos,2021-12-09 00:00:00,
jessica paticaoen cabilan right,2021-12-09 00:00:00,
ghie andres bagacina mother leni yun didnt attend might afraid prof clarita,2021-12-09 00:00:00,
dad took picture,2021-12-09 00:00:00,
popoy son roxas http mfacebookcom storyphpstory fbid5388775761 151929id100 0586765074,2021-12-09 00:00:00,
jessica paticaoen cabilan youre like im going attend scripted debate question know answer immediately look smart guest every answer question follow question immediately youll see pas recitation last defense,2021-12-09 00:00:00,
let trend guy,2021-12-09 00:00:00,
popoy son roxas yes cno kya didnt show difficult momentwhy absent,2021-12-09 00:00:00,
tpng jstn hashtag trending twitter hahaha,2021-12-09 00:00:00,
