text,timestamp,like_count
god bless bbm,2021-12-09,
god bless bbm sarah,2021-12-09,
always keep safe unitame,2021-12-09,
keep safe always future president god bless,2021-12-09,
thank manilenos warm welcome bbmsaras caravan uniteam,2021-12-09,
bottom heart,2021-12-09,
president bbm sir bongbong marcos godbless please safe always uniteam msara2 022,2021-12-09,
always careful sir traitor supporter party wave avoid shaking hand may god protect bless u always ur daily doings,2021-12-09,
god bless always future president sir bbm long live uniteam,2021-12-09,
manilenos support love president ferdinand bongbong marcos jr take care god bless po god good time,2021-12-09,
love marcos family,2021-12-09,
god bless bbm sara,2021-12-09,
may lord jesus christ cover precious blood president sir bbm send holy mighty thousand angel keep protect harm plan enemy wherever go whatever god sir bbm,2021-12-09,
bbm sara uniteam keep safe good luck god bless,2021-12-09,
yes god bless uniteam,2021-12-09,
god bless sir,2021-12-09,
god bless po,2021-12-09,
careful president,2021-12-09,
god bless sir bbm president,2021-12-09,
keep flying dream country birth father motherjesusmaram thank much,2021-12-09,
god bless mr president bongbong marcos love,2021-12-09,
keep safe god bless,2021-12-09,
may god protect always sir bbm careful im one prayer warrior may god favor upon,2021-12-09,
ching h santiago jesus name amen,2021-12-09,
real hero fighting ancestor god appointed bbm rule country people manila live good luck god bless citizen manila please continue fight ancestor filipino unity long live filipino long live country birth,2021-12-09,
careful future president bbm future vice president sara opponent mixing caravan use bullet proof bmw provided mayor chavit singson keep safe know election near fine safe god bless protect time,2021-12-09,
keep safe gbu bbm,2021-12-09,
god bless president bbm uniteam tondo love always keep safe,2021-12-09,
god bless bbmsara uniteam,2021-12-09,
god bless philippine next president vice president,2021-12-09,
god bless always bbm sara,2021-12-09,
stay safe strong,2021-12-09,
love bbmsara tandem god bless camotes island,2021-12-09,
god bless,2021-12-09,
god bless sir bongbongour next pres,2021-12-09,
power mr president philippine bongbong marcos god bless always,2021-12-09,
god bless future president bbm vp sara,2021-12-09,
please stay safe,2021-12-09,
keep safe excited uniteam,2021-12-09,
wow thank much bbm sara,2021-12-09,
unity achieve peace,2021-12-09,
god bless bbmsara plus team line,2021-12-09,
pray family sir bbm yngatz po always bbmsara2022 uniteam,2021-12-09,
god bless careful,2021-12-09,
thought woman jumping men tooand child screaming bbm really amazing see unity philippine nice see nice feel god bless sir bbm god bless uniteam god bless u together rise filipino,2021-12-09,
god bless sir bbm,2021-12-09,
godbless people manila show love unity team,2021-12-09,
onwards victory uniteam god protect bbmsara hope better philippine,2021-12-09,
god bless bbmsara uniteam winning team solid kmi,2021-12-09,
keep safe always,2021-12-09,
stay safe sir bbm god bless always,2021-12-09,
solid apo bbm landslide still winner always careful love president godbless,2021-12-09,
always careful kayuour future presidentmagpa take breath time energy strength next caravan campaign take food supplement always always fresh audience may good lord jesus overwhelm wd divine protection god bless bbm close 2022,2021-12-09,
boot alcantara bbm concern grandma think,2021-12-09,
may god bless mr bbm mam sara uniteam good filipino philippine,2021-12-09,
god bless future president ident2022,2021-12-09,
godbless bongbong marcos may almighty god protect always long live uniteam long live philippine,2021-12-09,
rubydais flower flower http judithlisa0,2021-12-09,
worth patience wait sir saw twelve oclock waited caravan started 3 six oclock always stay safe sir,2021-12-09,
wow wow take care sir bbm god bless uniteam,2021-12-09,
love n support bbm allah never leave youyoure always daily prayersi hope n pray meet even outside doorwishing dream inday sara lovenmissyou lyn mohamad,2021-12-09,
matter thrown mrpresident still remain humble even though hand injured still shake hand people art sign fatigue dont worry everyone sacrifice reward galaxybecau know time universe already blessed,2021-12-09,
always take care future presidentrest well sir dont go hungrywe love youuniteamgod bless,2021-12-09,
protect bbm indaysara uniteam hope,2021-12-09,
sir bbm always pray god always protect people harm,2021-12-09,
god bless bongbong marcos sarah duterte,2021-12-09,
god bless bbm sarah,2021-12-09,
love bbm sarah,2021-12-09,
always take care daddy mr prisedent love rise,2021-12-09,
yes tnx u guy keep safe everyone,2021-12-09,
let pray together,2021-12-09,
take care lge sir solid bbm marcos still pray ur win sir cheating anymore fight friend solid long live sir team uniteam stay safe po every 1 godbless u,2021-12-09,
god bless bbm,2021-12-09,
god bless bbm sarah,2021-12-09,
god always protect sir bbm,2021-12-09,
high hope sir,2021-12-09,
god bless bbm sarah,2021-12-09,
stay safe sir bonbong future pre,2021-12-09,
proud martial law baby,2021-12-09,
love full support bongbong sara uniteam live unstoppable,2021-12-09,
united stand divided fall protect bbm protect country long live philippine,2021-12-09,
goodluck god bless president keep safe always,2021-12-09,
keep safe always pop,2021-12-09,
lord protect bless future president bbm uniteam,2021-12-09,
innocent marcos loyalist marcos governance best,2021-12-09,
god bless people manila bbm president vice president sarah duterte god bless,2021-12-09,
god bless dear bbm,2021-12-09,
good luck god bless bbm go go go,2021-12-09,
god bless protect bbm,2021-12-09,
love crowd 90 percent victory solid mindanao,2021-12-09,
hi ser still expecting u visit mountain province,2021-12-09,
bbm sara uniteam solid god bless uniteam safe always,2021-12-09,
waiting bacolod bbmsara,2021-12-09,
god bless always bbm,2021-12-09,
always pray future president,2021-12-09,
god bless,2021-12-09,
love u sir bbm keep safe god bless philippine,2021-12-09,
ronald guzman delacruz,2021-12-09,
god bless uniteam,2021-12-09,
bellymary orboc catarman geli topic maybe want digital art sketch car icature paint g animated cheap pm interested pede family friend gfbf etc,2021-12-09,
god bless bbmsara uniteam,2021-12-09,
thats right sirbbm let filipino people work together towards unity country develop deprived true care long time people greedy selfish desire year 2022 would beva great year u bbm lead country god bless sir pres,2021-12-09,
loved majority filipino,2021-12-09,
celia c love good evening po bring notice great opportunity start earning huge income comfort home experience needed hidden fee withdraw profit 5 day click link start earning http securedfxtrade 10797769842893 5,2021-12-09,
god bless president bbm keep safe healthy,2021-12-09,
handshake bbm god bless,2021-12-09,
always careful whether caravanhope wave peopleso dont pull arm dont criminateand also avoid attempt life slash wrist supporter move stand election,2021-12-09,
god blessuniteam,2021-12-09,
god bless bbm sara,2021-12-09,
bbm pay attention u dabawenyos already president inday sara remind good luck god bless uniteam safe,2021-12-09,
keep safe always,2021-12-09,
keep safe nxt president vice presidentbbm sara 2022 see tomorrow bacolod city grand rally,2021-12-09,
im proud president keep safe good health bbm hope win love always,2021-12-09,
vote straight bbm sara uniteam love future president god guide en protect time,2021-12-09,
thank future president dont give may lord give strength good health filipino people trust love president bongbong marcos,2021-12-09,
god blessed phil name jesus bbm uniteam amen,2021-12-09,
always keep safe,2021-12-09,
amazing incredible picture people kid adult showed happy face show support beloved future president bbm,2021-12-09,
hope win please help poor eyesight pwd,2021-12-09,
hometown born 30 yr old got married moved north bbm solid family inday sara,2021-12-09,
god bless safe alwaysbbm sara,2021-12-09,
best shot ever,2021-12-09,
wave dont shake hand first careful grandpa bbm may allah protect bless,2021-12-09,
keep safe always,2021-12-09,
god bless bbm team,2021-12-09,
great hope pray u support uniteam go may 9 cast vote undecided base choice observe campaign period positive campaigning great impact especially young registered voter t2022 2 need thinking president one think speaking need president carry hatred especially longlasting hatred hatred divide people long long long time hatred lead goodness 2022,2021-12-09,
make u proud heartwarming many u love bbm sara sir bbm please take care wound handwe feel love concern filipino people love bbm sara,2021-12-09,
keep safe,2021-12-09,
blessed always bbmyou really solid bos,2021-12-09,
solid unbreakable many storm life passed bongbong remained strong even beating batman superman physically emotionally still brave give develop beloved country philippine 2022 solid,2021-12-09,
god bless u bbm sarah,2021-12-09,
thank god take care always bbmsara uniteam,2021-12-09,
presidency bbm hope lift country philippine poverty reduce maralco destroy made worker rich raise wage worker eliminate discrimination among applicant whether education nothing long work give chance work burden society every filipino looking life,2021-12-09,
bbm sara uniteam keep safe n god bless,2021-12-09,
keep safe always,2021-12-09,
anabella gordo http judithlisa0,2021-12-09,
yes solid bbm inday sara duterte uniteam let filipino live together change progress god bless,2021-12-09,
praying safety sir bbm,2021-12-09,
imalways pray god guide u always protect u president,2021-12-09,
pray support safety uniteam,2021-12-09,
always thats many supporter participate bbmsara love uniteam god bless everyone,2021-12-09,
pray pop aunt sara whole uniteam,2021-12-09,
rachel cheng caught bbm omg unforgettable scene manila hot encounter http youtubecom watchvauyozmor qwsfeaturesha,2021-12-09,
patrick tagle bbm come thats didnt see aurora,2021-12-09,
rachel cheng national pop remember sandro,2021-12-09,
r opo thats call attorney liza mom tita inday tito attorney husband fun,2021-12-09,
bbm sarah partner forever love,2021-12-09,
always careful next president solid bbm ng cagayan god bless,2021-12-09,
keep safe always future president vice president,2021-12-09,
burst tear see picture,2021-12-09,
difference really big person bbm everyone want hold hand god bless god 1st manila bbmsara,2021-12-09,
careful sir bbm also hurt saw injured hand swollen left hand wound right hand pain long possible please dont shake hand safety god bless god always protect family people love,2021-12-09,
dear next president philippine correct everything sincerely rejoice warm welcome next president philippine declared goal win jesus name love pres marcos,2021-12-09,
good day want ask help little understanding hope ask little two child income imminent lockdown area due positive covid area po oneyearold child dede extra risk get eat day day one construction worker husband stuck hope help u,2021-12-09,
solid solid thank lord,2021-12-09,
god bless president bbm,2021-12-09,
god bless philippine,2021-12-09,
always careful sir bbm possible dont shake hand safety health sir long live philippine,2021-12-09,
never change dear president bbm elected position help cause change careful upcoming president bbm god richly bless,2021-12-09,
even better bbm uniteam rally philippine flag wave candidate dont even philippine flag,2021-12-09,
really manila back really loved marcos family bbm lng,2021-12-09,
cathy pattung banatao http judithlisa0,2021-12-09,
stay safe always next president,2021-12-09,
top fan lena tibay,2021-12-09,
sir plaga careful fight end,2021-12-09,
take care president ferdinand r marcos jr marcos forever,2021-12-09,
president bbmtake care god bless even whole family,2021-12-09,
bbm sara praying victory,2021-12-09,
bbm solid god bless u,2021-12-09,
great posted,2021-12-09,
bbmsarastay safe god bless,2021-12-09,
keep safe always pop rest uniteam,2021-12-09,
solid bbm sara god bless,2021-12-09,
zamboanga city solid solid together rise,2021-12-09,
call love precious,2021-12-09,
daddy bongbong marcos praying fast healing hand supporter shake hand people hope wound heal quickly always praying safety,2021-12-09,
im proud even child supporting,2021-12-09,
true leader unites people divide find fault find remedy show hate cultivates love proud bbm,2021-12-09,
auto heart,2021-12-09,
take care always may god bless always,2021-12-09,
goodluck godbless bbm sara uniteam solid mabuhay filipino cry people bbm next president sara vice president keep safe always,2021-12-09,
pray victory,2021-12-09,
stay safe please,2021-12-09,
god bless uniteam may live long take care always esp bbm london,2021-12-09,
careful may lord godbless,2021-12-09,
every step way mr president,2021-12-09,
love next president bbm keep safe uniteam,2021-12-09,
may good lord protect harm danger sir bbm live well love,2021-12-09,
next president republic philippine ferdinand bongbong marco jr,2021-12-09,
mylene villanueva damasco really cant run president vice president,2021-12-09,
ident2022 always careful future presidentyou manila supporter dr ong bbm voted isko used doc ong left behind poor doc,2021-12-09,
always careful coming president god always proud japan win continue good deed done father digz beloved country philippine rise,2021-12-09,
god love sir bongbong marcos,2021-12-09,
im proud president always take care family,2021-12-09,
get well dear president bbmmay lord god father take care campaign caravan,2021-12-09,
long live bbm god bless,2021-12-09,
proud kbl manila chapter member 2022 fill,2021-12-09,
god bless po next president solid bbm sara,2021-12-09,
today date 22 wish landslide win sir bbm coming may 09 election jesus name amen thank lord god,2021-12-09,
amelita b ochavillo amen,2021-12-09,
amelita b ochavillo amen,2021-12-09,
jennifer melo,2021-12-09,
keep safe,2021-12-09,
stay safe future president bbm god bless always,2021-12-09,
always support next president philippine,2021-12-09,
love mr pres bongbong marcos tondo manila,2021-12-09,
solid,2021-12-09,
keep safe future president vice president inday sara fellow bbmsara uniteam senatorials supporter keep u safe thanks manila warm welcome support apo bongbong hilarious,2021-12-09,
wow huge crowd indeed,2021-12-09,
god bless apo bbm,2021-12-09,
hope election ok people accept winlets listen aspiration every candidate dont cover eye eye heartsfor change philippine,2021-12-09,
future president careful everyone whole uniteam,2021-12-09,
careful sir bongbong marcos one want sit malacaniang,2021-12-09,
hope remove age limit work poor people still want find life age limit job poor,2021-12-09,
hope election tomorrow rest office malacanan palace,2021-12-09,
2022 humble future president,2021-12-09,
team bahay always follows always careful pres bbm vice pres hi sara,2021-12-09,
president pls take care health pls,2021-12-09,
nation shall great,2021-12-09,
yes solid bbm sarah stay safe,2021-12-09,
loyalist apo marcos still president keep going view bbm may win battle please following aspiration apo bbm request hope help people marcos last name native nueva ecija also ilocano ten child fighting every filipino towards true change let love filipino,2021-12-09,
bbm sara future president vicepresident always careful caravan,2021-12-09,
love u 22 2022,2021-12-09,
congratulation future president bbm future vice president inday sarah filipino people love even caravan grave people jumping really eager get lucky,2021-12-09,
keep safe sir bbmjust wave,2021-12-09,
amazing,2021-12-09,
safe bbm,2021-12-09,
always careful dear future president vicepresident wave dont shake hand possible keep safe true supporter love understand god bless,2021-12-09,
solid,2021-12-09,
bbm sara uniteam god bless,2021-12-09,
godbless apo lakay bbm silent worker north team,2021-12-09,
god bless bbm,2021-12-09,
careful bbmuniteam please wavebe safe,2021-12-09,
take care grandpa president bongbong marcos hope philippine possible please dont join caravan decided filipino bongbong sara may 2022 one deserve course prrd also term hope life longer help bbm,2021-12-09,
god mr president bbm vice president sarah duterte keep safe always watching every time cyprus,2021-12-09,
keep safe everyone,2021-12-09,
wow lanlide sure windy live philippinesthank u lord bbm sarah,2021-12-09,
bbm promise always careful many supporter trust love god bless,2021-12-09,
take care god bless losing weight maybe need rest first,2021-12-09,
like translation nazarene head number supporter god bless uniteam solid bbmsarah,2021-12-09,
wanna share way support artworksolid bbmsara,2021-12-09,
god bless philippine keep safe bbm,2021-12-09,
love bbminday sara,2021-12-09,
always careful apo bbm may god guide safety elected president republic philippine unity filipino people continue love apo bbm snuokahitkanino 022,2021-12-09,
bbmsarah tandem god bless,2021-12-09,
take care sir bbmgodbless,2021-12-09,
see tomorrow negro take care always please still need still need much love philippine put hope,2021-12-09,
may god bless bbm future president vice president sara duterte uniteamprotection safety upon,2021-12-09,
given opportunity photographer coverage son photographer fb page w rytronicsstudios thank godspeed,2021-12-09,
stay safe pop,2021-12-09,
love bbm sara muchmy president vp love,2021-12-09,
president congratulation winner winner take care,2021-12-09,
troll allowed solid marcos solid duterte,2021-12-09,
love u bbmsara,2021-12-09,
someone sure win bbmzara lord protect always,2021-12-09,
teng maynigo camacho solid bbm sarah,2021-12-09,
god bless grandpa bbm,2021-12-09,
pacman surely win,2021-12-09,
keep safe stay good health always,2021-12-09,
careful sir many enemy side side also many people dont believe lot anger pretending wound hand know hate kiss many fake news especially video making big issuepro look still flocking cheering campaign good luck stay safe sir bongbong marcos wave dont shake hand townspeople happy see least catch glimpse,2021-12-09,
mr president marcos dont shake hand take watch ring solid bbm close,2021-12-09,
banat n stewed president manila caravan cried laughing banat delicious hmm anyway congratulation uniteam success manila caravan keep safe everyone let continue pray safety,2021-12-09,
mj almazan maggay size eye became blind longer see people paid cash buy eye,2021-12-09,
take care always sir bbm love,2021-12-09,
true sir bbm manilenios trusting believe love whole uniteam president,2021-12-09,
please always take care president love,2021-12-09,
lord please watch mr president bbm marcos madam vice president sara inday duterte solid uniteam,2021-12-09,
manila center martial law said many killed abducted abused daw people manila came support bbm,2021-12-09,
love bbm sarakeep safe godbless uniteam,2021-12-09,
uniteam solid bbm sara 2022 careful god bless,2021-12-09,
god bless beloved country philippine god bless uniteam number one tandem,2021-12-09,
yes manila thats good job,2021-12-09,
keep safe,2021-12-09,
valenzuela asking,2021-12-09,
yes bbmsarauniteam,2021-12-09,
kya nmn porke manila c domagoso eh solid sa knya arrogant kc see people lht demeanor,2021-12-09,
thank manila,2021-12-09,
solid po,2021-12-09,
god bless future president live long may lord always guide bbmsara unitam,2021-12-09,
solid uniteam please keep safe,2021-12-09,
bbm u one kind solid supporter lebanon chapter,2021-12-09,
bbm president love bbm one running president without attacking anyone people power brought father people power also bring back son thats sir bbm,2021-12-09,
dear bbmsara check let cast ballot carefully upcoming election folk even name bbm leni go sara kiko maybe shade right side vote definitely go leni kiko whether intentional theyre equal name double check first dont get confused shade comradesthe tiger rule jungle eagle forsees itbbmsara national election 2022,2021-12-09,
im begging ladiessirs maybe heart reaction please please please link http 10028243643147 post 1015494692735309 appfbl thank much god bless,2021-12-09,
solid win,2021-12-09,
god bless mr president bongbong marcos together rise,2021-12-09,
together develop philippine,2021-12-09,
yes hoping really real change fm taken waley log lalo,2021-12-09,
please careful president godbless,2021-12-09,
may good lord bless guide mr president bbm,2021-12-09,
let bring back greatness beloved philippine bbmsara longlive,2021-12-09,
dear president careful love bbm solit marcos kay maam sara soolit,2021-12-09,
amen,2021-12-09,
dont shake hand maybe slashed dont heart wave,2021-12-09,
sure win sir bbm number supporter inday sara matter side choose ant amount people join caravan uniteam live bbm sara let win may 2022 god bless bbm sara,2021-12-09,
god bless president bbm always careful especially motorcade,2021-12-09,
nice always reach hand poor child cry tear q humble good example time caring protective filipino people lift weak time country go support president,2021-12-09,
mr president may given opportunity installed leader country help doc willie ong used isko moreno left air people shouting doc willie would better doh sec thank bbm solid supporter bbm sara po,2021-12-09,
please dont let happen sleep wake 22,2021-12-09,
well loved deserve position president mabu ay po kyopraying health safetygid bless,2021-12-09,
compatriot let join hand development country,2021-12-09,
solid po kmi bbm loyalist marcos family,2021-12-09,
always careful godfather always vow god bless always solid po kmi bbm,2021-12-09,
smile differently solid bbm see face happy dear president hope win,2021-12-09,
supporter wish safety first filipino people recover crisis filipino experiencing long live dear president support head boung family solid bbmsara tandem,2021-12-09,
blessed campaign sorte maximize safety please,2021-12-09,
always careful future president vice president,2021-12-09,
wowgod bless president philippine bongbong marcos,2021-12-09,
mr president double careful enemy sure angry angry see fear might something bad take care hope everyone remembered assassination happened madam imelda stabbed bolo please mr presidentmag doubly careful complacent people touched advice mr president kc one need hope get name back malacanyang careful 100 time mr president god bless victory,2021-12-09,
proud bbm sara uniteam,2021-12-09,
bbmsarah tandem perfect uniteam together rise,2021-12-09,
sir take rest sure win,2021-12-09,
love bbm,2021-12-09,
bad didnt go maceda many u waiting mr president stay safe long live uniteam,2021-12-09,
yen yen passed front house,2021-12-09,
rakel coloma hope sister huhu,2021-12-09,
always careful bbm people care god bless,2021-12-09,
movement bbms competitor today stop bbm fall desperate bbm may reach peak necessary vigilant watch bmm make sure bbm good condition bbm sara must shielded always stay safe healthy may good lord bless,2021-12-09,
doc willie left group,2021-12-09,
god bless future president t2022,2021-12-09,
keep safe future presidentbbm sara strong,2021-12-09,
yes bbm sara unitame solid support muntinlupa,2021-12-09,
hope behave novaliches see person even cant shake hand hope raise car cant shake hand imposter hurt hope dont give always careful,2021-12-09,
time unite towards success every filipinolets love philippine together rise grace god almightybbm next president republic philippine godbless po go ojr beloved country,2021-12-09,
whatever said delawan solid bbm nobody break u rock,2021-12-09,
pity didnt time look forward doesnt matter get close see long win fight enough fun stay safe,2021-12-09,
stay safe,2021-12-09,
god bless,2021-12-09,
uniteam,2021-12-09,
solid bbm sara nueva ecija working doha qatar,2021-12-09,
cagayan de oro city bbm sara 2022 still,2021-12-09,
wowgod bless,2021-12-09,
always careful dearest future president,2021-12-09,
double double careful sir bbm madam sara waiting sit,2021-12-09,
let unite,2021-12-09,
god bless president bong bong,2021-12-09,
unbeatable,2021-12-09,
take care always po future president dont youre hungrywe love apo lakay bbm sara uniteam,2021-12-09,
always careful sir bhong2 marcos future president,2021-12-09,
solid,2021-12-09,
ready 26 pangasinan show love future president,2021-12-09,
little time bbm install president country,2021-12-09,
solid,2021-12-09,
bbm sara solid,2021-12-09,
take care mr presidentwe love youyou filipino people neednaway god father heaven always protect jehovah,2021-12-09,
keep safe president,2021-12-09,
keep safe president keep safe uniteam,2021-12-09,
blessing,2021-12-09,
im sure theyre landslinde good luck politician,2021-12-09,
go go go bbm uniteam supporter unite improve country,2021-12-09,
thats face black latest photo uploaded apply uv cream every time caravan wave injured countryman want land know wasnt pandemic would want wrap tight hug,2021-12-09,
always take care uniteam bbm sara love tondo manila,2021-12-09,
careful bbm wavegod bless,2021-12-09,
t2022 love support bbm,2021-12-09,
support hk ofw,2021-12-09,
careful sir bbmwe know dedication desire 4 progress in2 countrymenbbm4president,2021-12-09,
see difference,2021-12-09,
unbeatable team,2021-12-09,
perfect tandem 2022 22,2021-12-09,
going caravan cagayan de oro excited,2021-12-09,
dont call troll haha im solid marcos make cry many supporter side believe fake news hope dont let money election there place sleep guard 8,2021-12-09,
god bless bbm sara solid stay strongest,2021-12-09,
hope also support,2021-12-09,
father roberto mercado former brgy captain cutud san fernando pampanga hope see future pres bongbong marcos work hid long time,2021-12-09,
bbm solid 4ever,2021-12-09,
bbm sara god bless,2021-12-09,
love mr president ferdinand bongbong marcos may lord dear father allah always protect,2021-12-09,
always careful bbm sara may lord protect always everywhere go,2021-12-09,
god bless love president philippine bbm vice president sara doterte,2021-12-09,
